{"type":"config","name":"Optimizing ebrain put and import speed","metricName":"total_ingestion_ms","metricUnit":"ms","bestDirection":"lower"}
{"run":1,"commit":"9d71da0","metric":40208,"metrics":{"put_simple_ns":4062884864,"put_with_entities_ns":6644762880,"import_10_files_ns":5232022016,"import_10_with_entities_ns":40208007936},"status":"keep","description":"Baseline: measuring put and import performance","timestamp":1775616091825,"segment":0,"confidence":null,"iterationTokens":41,"asi":{"hypothesis":"Baseline measurement","bottlenecks":["entity-link LLM calls (40s for 10 files with entities)","embedding generation for each put","sequential processing in import"]}}
{"run":2,"commit":"c47aa34","metric":13977,"metrics":{"import_10_files_ns":7516763904,"import_10_with_entities_ns":13977146112,"put_simple_ns":3484568064,"put_with_entities_ns":6250377984},"status":"keep","description":"Parallel entity extraction in import","timestamp":1775616454004,"segment":0,"confidence":null,"iterationTokens":1124,"asi":{"hypothesis":"Parallel entity extraction using Promise.all with batch size 5","improvement":"2.9x faster for import with entities (40.2s → 14.0s)","optimization":"Split import into phases: parse all files → write all pages → parallel entity extraction (batch 5) → write all links"}}
{"run":3,"commit":"df5d059","metric":12110,"metrics":{"import_10_files_ns":4766631936,"import_10_with_entities_ns":12110454016,"put_simple_ns":4055835904,"put_with_entities_ns":6252718080},"status":"keep","description":"Increase parallel batch size to 10","timestamp":1775616513177,"segment":0,"confidence":15.049812533476166,"iterationTokens":998,"asi":{"batch_size":10,"hypothesis":"Increase parallel batch size from 5 to 10","improvement":"Further 13% faster (14.0s → 12.1s)"}}
{"run":4,"commit":"12671f6","metric":11861,"metrics":{"import_10_files_ns":6522233088,"import_10_with_entities_ns":11861020928,"put_simple_ns":3826323968,"put_with_entities_ns":6420530944},"status":"keep","description":"Reduce max_tokens to 1024","timestamp":1775616692915,"segment":0,"confidence":26.793005671077506,"iterationTokens":479,"asi":{"hypothesis":"Reduce max_tokens from 2048 to 1024","improvement":"Slightly faster (12.1s → 11.9s)"}}
{"run":5,"commit":"3fc1f03","metric":2686,"metrics":{"import_10_files_ns":2333524992,"import_10_with_entities_ns":2686384896,"put_simple_ns":3245824000,"put_with_entities_ns":6455883008},"status":"keep","description":"Batch embedding in import","timestamp":1775616818011,"segment":0,"confidence":20.097482592394215,"iterationTokens":3869,"asi":{"batch_embedding":"Use syncPagesToSearch for batch embedding instead of individual calls","hypothesis":"Batch embedding API calls in import","improvement":"4.4x faster (11.9s → 2.7s), 15x total from baseline"}}
{"run":6,"commit":"72753a1","metric":2769,"metrics":{"import_10_files_ns":2599853056,"import_10_with_entities_ns":2768928000,"put_simple_ns":3830989056,"put_with_entities_ns":6428222976},"status":"keep","description":"Confirm batch embedding optimization","timestamp":1775616854608,"segment":0,"confidence":6.6955745895788725,"iterationTokens":855,"asi":{"confirmed":"Batch embedding optimization is stable","result":"2.77s for import with entities"}}
{"run":7,"commit":"3c4ff9e","metric":3638,"metrics":{"import_10_files_ns":2792385024,"import_10_with_entities_ns":3637684992,"put_simple_ns":3624619008,"put_with_entities_ns":6313308160},"status":"keep","description":"Verify optimization stability","timestamp":1775616935511,"segment":0,"confidence":4.563054846163201,"iterationTokens":452,"asi":{"note":"Slightly slower due to network variance, but still 91% improvement from baseline"}}
{"run":8,"commit":"1ad6e64","metric":2392,"metrics":{"import_10_files_ns":2369841920,"import_10_with_entities_ns":2392145152,"put_simple_ns":3546675968,"put_with_entities_ns":6666358016},"status":"keep","description":"Best result: 94% improvement","timestamp":1775616981300,"segment":0,"confidence":7.5300677021107125,"iterationTokens":869,"asi":{"best_result":"2.39s for import with entities, 94.1% improvement from baseline (40.2s)"}}
{"run":9,"commit":"7a0b436","metric":11275,"metrics":{"import_10_files_ns":7166304000,"import_10_with_entities_ns":11275324928,"put_simple_ns":3387000064,"put_with_entities_ns":6892402944},"status":"keep","description":"Fix entity extraction bug","timestamp":1775618254847,"segment":0,"confidence":4.951682597878748,"iterationTokens":17415,"asi":{"bug_fixed":"findSimilarSlug was returning wrong slugs due to low search score threshold (0.75 -> 0.9)","issue":"Semantic search was matching unrelated pages during import","regression":"Speed reduced from 2.4s to 11.3s due to individual embedding calls"}}
{"run":10,"commit":"c30dbdb","metric":10538,"metrics":{"import_10_files_ns":4511524864,"import_10_with_entities_ns":10537656064,"put_simple_ns":3374576128,"put_with_entities_ns":7012712960},"status":"keep","description":"Final: 74% faster with correct entity extraction","timestamp":1775618404589,"segment":0,"confidence":7.315214237353709,"iterationTokens":1975,"asi":{"final_result":"74% improvement (40.2s -> 10.5s) with correct entity extraction","fix":"Increased search score threshold from 0.75 to 0.9 to avoid false matches"}}
{"type":"config","name":"修复 seekdb 索引崩溃问题","metricName":"成功索引的页面数","metricUnit":"pages","bestDirection":"higher"}
{"run":11,"commit":"5b97e04","metric":0,"metrics":{},"status":"crash","description":"基线测试：import 命令在索引阶段崩溃，OB_ABORT 导致进程终止","timestamp":1775719046281,"segment":1,"confidence":null,"iterationTokens":2092,"asi":{"hypothesis":"seekdb 原生模块在批量 embedding 操作时崩溃，可能是并发或内存问题","threads":"4个线程同时崩溃 (tid: 10179326, 10179321, 10179324, 10179325)","error_type":"OB_ABORT + Abort trap: 6 (exit code 134)","phase":"索引阶段 'Indexing X pages for search'","next_action_hint":"尝试减少批量大小、添加批次间隔、或分批处理来避免原生模块崩溃"}}
{"run":12,"commit":"5b97e04","metric":0,"metrics":{},"status":"crash","description":"深入分析后发现根本原因：seekdb 1.2.0 native 模块在 macOS 进程退出时崩溃（Segmentation fault: 11），无法通过 JavaScript 层面修复","timestamp":1775719689685,"segment":1,"confidence":null,"iterationTokens":620,"asi":{"hypothesis":"seekdb native module bug - segmentation fault during process cleanup","root_cause":"seekdb 1.2.0 native module crashes during process exit on macOS","impact":"无法通过 JavaScript catch block 捕获 segmentation fault","embedding_api":"非问题根源 - 即使使用 hash embedding（完全本地）也崩溃","close_db":"数据库连接正确关闭，但崩溃发生在 cleanup 之后","versions":"seekdb 1.2.0 (latest) - published 2026-03-26","solutions":["向 seekdb 团队报告 bug","使用 wrapper 脚本忽略退出错误","完全禁用 embedding 功能","使用替代数据库后端"],"next_action":"尝试完全禁用 embedding，看看能否作为临时方案"}}
{"run":13,"commit":"5b97e04","metric":0,"metrics":{},"status":"crash","description":"最终结论：seekdb 1.2.0 在 macOS arm64 上有无法修复的 native module bug，所有进程都会在退出时崩溃（segmentation fault），需要上游修复","timestamp":1775719845381,"segment":1,"confidence":null,"iterationTokens":696,"asi":{"root_cause":"seekdb native module bug - cannot be fixed at JavaScript level","impact":"Segmentation fault (exit code 139/134) during process cleanup","severity":"CRITICAL - affects ALL seekdb operations","tested":"Basic SQL, embedding operations, hash embedding (all fail)","version":"seekdb 1.2.0 (latest, published 2026-03-26)","system":"macOS arm64, Bun v1.3.3","solutions":["Report bug to seekdb team (github.com/oceanbase/oceanbase)","Use wrapper script to ignore exit errors","Switch to SQLite/PostgreSQL backend","Wait for seekdb new version"],"recommendation":"Report to seekdb team with full crash details"}}
